{
  "asf": "1.0",
  "kind": "safety-binding",
  "adopter": {
    "ref": "eip155:11155111:0x00000000000000000000000000000000000000aa",
    "role": "swarm member A (self-adoption)"
  },
  "subject": {
    "ref": "eip155:11155111:0x00000000000000000000000000000000000000aa",
    "kind": "member agent account",
    "key": "0x8a1716e0a2393915e72e3435a262e1f681d2e38303ff7ac29ef5e054035e1ac3"
  },
  "scope": {
    "object": {
      "task": "x:task-tender:eip155:11155111:0x0000000000000000000000000000000000007a5c:17",
      "phase": "execution"
    },
    "key": "0x045b0f249b8616b9027a0d0589d5b84c2b6d16127853a2db940d1e6c1c264e18"
  },
  "specification": {
    "registry": "eip155:11155111:0x00000000000000000000000000000000000a5f01",
    "specId": "0x2503d18c94ea1a5bd487cc8f1f8bde84f51623c8426e450214d92218a327f0dd",
    "version": 1,
    "contentHash": "0x742677b7faac6a42c52490330c70b4f23c0b4d455f0126817b56bb7f91aee2ab",
    "locator": "ipfs://example/swarm-shared-funds.v1.json",
    "name": "Swarm Shared Funds"
  },
  "parameters": {
    "asf:profile:economic/shared-budget@1": {
      "denomination": "eip155:11155111/slip44:60",
      "totalCap": "150",
      "coordination": "reserve-commit-release",
      "coordinator": "eip155:11155111:0x0000000000000000000000000000000000c00e0d",
      "members": [
        "eip155:11155111:0x00000000000000000000000000000000000000aa",
        "eip155:11155111:0x00000000000000000000000000000000000000bb",
        "eip155:11155111:0x00000000000000000000000000000000000000cc"
      ],
      "settlementUnknownPolicy": "reconcile-before-retry"
    },
    "asf:profile:authority/bounded-spend@1": {
      "denomination": "eip155:11155111/slip44:60",
      "perActionCap": "50",
      "windowCap": "100",
      "windowSeconds": 86400
    },
    "asf:profile:governance/intervention@1": {
      "interveners": [
        {
          "role": "organizer",
          "rights": [
            "suspend"
          ],
          "basis": "charter clause 4"
        },
        {
          "role": "charter decision",
          "rights": [
            "suspend",
            "resume",
            "terminate"
          ],
          "basis": "charter clause 5"
        }
      ],
      "allowedModes": [
        "no-new-risk",
        "derisk-only",
        "full-stop"
      ],
      "deriskActions": [
        "repay",
        "cancel",
        "withdrawToTreasury"
      ],
      "dispute": "eip155:11155111:0x0000000000000000000000000000000000ac0df0/policy/0x01",
      "recovery": "charter decision"
    }
  },
  "authorityBasis": [
    {
      "kind": "swarm-membership",
      "ref": "x:swarm:eip155:11155111:0x00000000000000000000000000000000000005aa:7/member/0x00000000000000000000000000000000000000aa",
      "description": "member A's membership record in the swarm"
    }
  ],
  "mechanisms": [
    {
      "channel": "member-account",
      "mechanism": {
        "kind": "wallet-permission",
        "ref": "member A account permission"
      },
      "location": "account",
      "coverage": "full"
    },
    {
      "channel": "budget-coordinator",
      "mechanism": {
        "kind": "shared-budget-coordinator",
        "ref": "eip155:11155111:0x0000000000000000000000000000000000c00e0d"
      },
      "location": "contract",
      "coverage": "full"
    }
  ],
  "derived": {
    "parentBindingId": "0x118fa978c4f4d42f9b1ab112aa01f382d8a2cd74aea40b0efc6c4804ba1db895",
    "narrowing": {
      "asf:profile:economic/shared-budget@1": {
        "relation": "equal",
        "basis": "group parameters are kept unchanged by a member binding"
      },
      "asf:profile:authority/bounded-spend@1": {
        "relation": "narrower",
        "basis": "perActionCap 50 <= 100, windowCap 100 <= 100, same window"
      },
      "asf:profile:governance/intervention@1": {
        "relation": "equal",
        "basis": "interveners and modes unchanged"
      }
    }
  },
  "validity": {
    "until": 1830000000
  },
  "interveners": [
    {
      "ref": "eip155:11155111:0x0000000000000000000000000000000000ac0df0",
      "rights": [
        "suspend",
        "resume",
        "terminate"
      ],
      "role": "charter decision executor"
    }
  ],
  "metadata": {
    "salt": "0x0000000000000000000000000000000000000000000000000000000000000031",
    "parentExample": "swarm-charter.binding.json"
  }
}
