{
  "asf": "1.0",
  "kind": "safety-binding",
  "adopter": {
    "ref": "eip155:11155111:0x00000000000000000000000000000000000060a9",
    "role": "swarm organizer"
  },
  "subject": {
    "ref": "x:swarm:eip155:11155111:0x00000000000000000000000000000000000005aa:7",
    "kind": "registered swarm",
    "key": "0x009877fda26d47f7d13d6c9ded954b9dbd29e7cf34cc8ff23cc2f015d193c272"
  },
  "scope": {
    "object": {
      "task": "x:task-tender:eip155:11155111:0x0000000000000000000000000000000000007a5c:17",
      "phase": "execution"
    },
    "key": "0x045b0f249b8616b9027a0d0589d5b84c2b6d16127853a2db940d1e6c1c264e18"
  },
  "specification": {
    "registry": "eip155:11155111:0x00000000000000000000000000000000000a5f01",
    "specId": "0x2503d18c94ea1a5bd487cc8f1f8bde84f51623c8426e450214d92218a327f0dd",
    "version": 1,
    "contentHash": "0xf904b2cd306325816a993a258d8268558ac67c3b4206a3187d22bff56b36b9fd",
    "locator": "ipfs://example/swarm-shared-funds.v1.json",
    "name": "Swarm Shared Funds"
  },
  "parameters": {
    "asf:profile:economic/shared-budget@1": {
      "denomination": "eip155:11155111/slip44:60",
      "totalCap": "150",
      "coordination": "reserve-commit-release",
      "coordinator": "eip155:11155111:0x0000000000000000000000000000000000c00e0d",
      "members": [
        "eip155:11155111:0x00000000000000000000000000000000000000aa",
        "eip155:11155111:0x00000000000000000000000000000000000000bb",
        "eip155:11155111:0x00000000000000000000000000000000000000cc"
      ],
      "settlementUnknownPolicy": "reconcile-before-retry"
    },
    "asf:profile:authority/bounded-spend@1": {
      "denomination": "eip155:11155111/slip44:60",
      "perActionCap": "100",
      "windowCap": "100",
      "windowSeconds": 86400
    },
    "asf:profile:governance/intervention@1": {
      "interveners": [
        {
          "role": "organizer",
          "rights": [
            "suspend"
          ],
          "basis": "charter clause 4"
        },
        {
          "role": "charter decision",
          "rights": [
            "suspend",
            "resume",
            "terminate"
          ],
          "basis": "charter clause 5"
        }
      ],
      "allowedModes": [
        "no-new-risk",
        "derisk-only",
        "full-stop"
      ],
      "deriskActions": [
        "repay",
        "cancel",
        "withdrawToTreasury"
      ],
      "dispute": "eip155:11155111:0x0000000000000000000000000000000000ac0df0/policy/0x01",
      "recovery": "charter decision"
    }
  },
  "authorityBasis": [
    {
      "kind": "swarm-charter",
      "ref": "x:swarm:eip155:11155111:0x00000000000000000000000000000000000005aa:7/charter/2",
      "description": "the charter authorizes the organizer to adopt safety arrangements for the swarm"
    },
    {
      "kind": "task-tender-terms",
      "ref": "x:task-tender:eip155:11155111:0x0000000000000000000000000000000000007a5c:17/terms",
      "description": "the tender requires this arrangement of the fulfilling swarm"
    }
  ],
  "mechanisms": [
    {
      "channel": "budget-coordinator",
      "mechanism": {
        "kind": "shared-budget-coordinator",
        "ref": "eip155:11155111:0x0000000000000000000000000000000000c00e0d"
      },
      "location": "contract",
      "coverage": "full"
    },
    {
      "channel": "charter-decision",
      "mechanism": {
        "kind": "collective-decision",
        "ref": "eip155:11155111:0x0000000000000000000000000000000000ac0df0/policy/0x01"
      },
      "location": "collective",
      "coverage": "full"
    }
  ],
  "validity": {
    "until": 1830000000
  },
  "interveners": [
    {
      "ref": "eip155:11155111:0x0000000000000000000000000000000000ac0df0",
      "rights": [
        "suspend",
        "resume",
        "terminate"
      ],
      "role": "charter decision executor"
    }
  ],
  "metadata": {
    "salt": "0x0000000000000000000000000000000000000000000000000000000000000021"
  }
}
